{
  "schema_version": "2.0.0",
  "record_id": "FIXTURE-RUN",
  "synthetic": true,
  "lane": "public_core",
  "scientific_numeric_inputs": [
    {
      "source_id": "FIXTURE-SOURCE",
      "origin": "public_external",
      "admitted": true,
      "role": "DEVELOPMENT"
    }
  ],
  "model_release_id": "FIXTURE-CORE-IDENTIFIABILITY",
  "output_namespace": "fixtures/only"
}
